{
  "$schema": "https://json-schema.org/draft/2020-12/schema",
  "$id": "https://sandra.local/schemas/execution-plan.schema.json",
  "title": "ExecutionPlan",
  "type": "object",
  "additionalProperties": false,
  "required": [
    "apiVersion",
    "kind",
    "metadata",
    "decisionRef",
    "subjectRef",
    "capabilityRef",
    "adapter",
    "prechecks",
    "actions",
    "postchecks",
    "recovery",
    "limits",
    "createdAt",
    "expiresAt",
    "digest"
  ],
  "properties": {
    "apiVersion": {
      "const": "governance.sandra.io/v1"
    },
    "kind": {
      "const": "ExecutionPlan"
    },
    "metadata": {
      "type": "object",
      "additionalProperties": false,
      "required": [
        "id",
        "revision"
      ],
      "properties": {
        "id": {
          "type": "string",
          "pattern": "^plan_[a-z0-9]{16,64}$"
        },
        "revision": {
          "type": "integer",
          "minimum": 1
        }
      }
    },
    "decisionRef": {
      "type": "string"
    },
    "subjectRef": {
      "type": "string"
    },
    "capabilityRef": {
      "type": "string"
    },
    "adapter": {
      "type": "object",
      "additionalProperties": false,
      "required": [
        "id",
        "version"
      ],
      "properties": {
        "id": {
          "type": "string"
        },
        "version": {
          "type": "string"
        }
      }
    },
    "prechecks": {
      "type": "array",
      "items": {
        "type": "string"
      },
      "minItems": 1
    },
    "actions": {
      "type": "array",
      "items": {
        "type": "string"
      },
      "minItems": 1
    },
    "postchecks": {
      "type": "array",
      "items": {
        "type": "string"
      },
      "minItems": 1
    },
    "recovery": {
      "type": "array",
      "items": {
        "type": "string"
      }
    },
    "limits": {
      "type": "object"
    },
    "createdAt": {
      "type": "string",
      "format": "date-time"
    },
    "expiresAt": {
      "type": "string",
      "format": "date-time"
    },
    "digest": {
      "type": "object",
      "additionalProperties": false,
      "required": [
        "algorithm",
        "value"
      ],
      "properties": {
        "algorithm": {
          "const": "sha256"
        },
        "value": {
          "type": "string",
          "pattern": "^[a-f0-9]{64}$"
        }
      }
    }
  }
}
